{
  "schema": "example.readiness/v1",
  "product_version": "0.01.000",
  "catalog_sha256": "0000000000000000000000000000000000000000000000000000000000000000",
  "contracts": [
    {
      "id": "params-record",
      "version": "1.0.0",
      "status": "fixture",
      "provenance": "fixture",
      "state": "provider",
      "reason": {
        "en": "Served by its fixture provider; the real producer is not built yet."
      },
      "missing": []
    }
  ]
}
