{
  "schema": "alerts.readiness/v1",
  "product_version": "0.04.000",
  "catalog_sha256": "aaaaaaaaaaaaaaaaaaaaaaaaaaaaaaaaaaaaaaaaaaaaaaaaaaaaaaaaaaaaaaaa",
  "contracts": [
    {
      "id": "alert-event",
      "version": "1.0.0",
      "status": "simulator",
      "provenance": "simulator",
      "state": "provider",
      "reason": {
        "en": "the simulator answers",
        "es": "the simulator answers (es)"
      },
      "missing": []
    }
  ]
}
